"2R2LLC6J","journalArticle","2019","Liu, Chi; Huang, Yue; Ozolek, John A.; Hanna, Matthew G.; Singh, Rajendra; Rohde, Gustavo K.","SetSVM: An Approach to Set Classification in Nuclei-Based Cancer Detection","IEEE Journal of Biomedical and Health Informatics","","2168-2208","10.1109/JBHI.2018.2803793","","Due to the importance of nuclear structure in cancer diagnosis, several predictive models have been described for diagnosing a wide variety of cancers based on nuclear morphology. In many computer-aided diagnosis (CAD) systems, cancer detection tasks can be generally formulated as set classification problems, which can not be directly solved by classifying single instances. In this paper, we propose a novel set classification approach SetSVM to build a predictive model by considering any nuclei set as a whole without specific assumptions. SetSVM features highly discriminative power in cancer detection challenges in the sense that it not only optimizes the classifier decision boundary but also transfers discriminative information to set representation learning. During model training, these two processes are unified in the support vector machine (SVM) maximum separation margin problem. Experiment results show that SetSVM provides significant improvements compared with five commonly used approaches in cancer detection tasks utilizing 260 patients in total across three different cancer types, namely, thyroid cancer, liver cancer, and melanoma. In addition, we show that SetSVM enables visual interpretation of discriminative nuclear characteristics representing the nuclei set. These features make SetSVM a potentially practical tool in building accurate and interpretable CAD systems for cancer detection.","2019-01","2021-06-04 19:05:18","2021-06-07 17:44:32","","351-361","","1","23","","","SetSVM","","","","","","","","","","","","IEEE Xplore","","Conference Name: IEEE Journal of Biomedical and Health Informatics","","C:\Users\Asus\Zotero\storage\LZJR73H5\8286915.html","","","Predictive models; Cancer; Training; Kernel; visualization; Support vector machines; Cancer detection; digital pathology; nuclear quantification; nuclear structure; Prototypes; set classification","","","","","","","","","","","","","","","","","","","","","","","","","","","","","","","","","","","","","","","","","","","","","",""
"U2LZMVE7","journalArticle","2021","Dong, Guanfang; Ma, Yingnan; Basu, Anup","Feature-Guided CNN for Denoising Images From Portable Ultrasound Devices","IEEE Access","","2169-3536","10.1109/ACCESS.2021.3059003","","As a non-invasive medical imaging scanning device, ultrasound has greatly increased the efficiency and accuracy of medical diagnosis. In recent years, portable ultrasound is being more widely used for its convenience and lower cost. Patients and physicians can receive the scanned images on their mobile phones at any time via a wireless network with low latency. However, it is difficult for portable ultrasound devices to capture images with the same quality as standard hospital ultrasound image acquisition systems. Usually, the images captured by portable ultrasound equipment have considerable noise. This noise undoubtedly affects the diagnosis of the physician. It is imperative to develop methods to remove the noise while preserving important information in the image. For this reason, we propose a novel denoising neural network model, called Feature-guided Denoising Convolutional Neural Network (FDCNN), to remove noise while retaining important feature information. In order to achieve high-quality denoising results, we employ a hierarchical denoising framework driven by a feature masking layer for medical images. Furthermore, we propose a feature extraction algorithm based on Explainable Artificial Intelligence (XAI) for medical images. Experimental results show that our medical image feature extraction method outperforms previous methods. Combined with the new denoising neural network architecture, portable ultrasound devices can now achieve better diagnostic performance.","2021","2021-06-04 19:05:18","2021-06-04 19:05:18","","28272-28281","","","9","","","","","","","","","","","","","","","IEEE Xplore","","Conference Name: IEEE Access","","C:\Users\Asus\Zotero\storage\9LFY32C8\Dong et al. - 2021 - Feature-Guided CNN for Denoising Images From Porta.pdf; C:\Users\Asus\Zotero\storage\GUMSKEH8\9353537.html","","","Medical diagnostic imaging; Feature extraction; Image edge detection; Ultrasonic imaging; Anisotropic magnetoresistance; Backpropagation; Biomedical image processing; feature extraction; image denoising; image fusion; Noise reduction","","","","","","","","","","","","","","","","","","","","","","","","","","","","","","","","","","","","","","","","","","","","","",""
"8K8TELJ2","journalArticle","2020","He, Ji; Wang, Yongbo; Ma, Jianhua","Radon Inversion via Deep Learning","IEEE Transactions on Medical Imaging","","1558-254X","10.1109/TMI.2020.2964266","","The Radon transform is widely used in physical and life sciences, and one of its major applications is in medical X-ray computed tomography (CT), which is significantly important in disease screening and diagnosis. In this paper, we propose a novel reconstruction framework for Radon inversion with deep learning (DL) techniques. For simplicity, the proposed framework is denoted as iRadonMAP, i.e., inverse Radon transform approximation. Specifically, we construct an interpretable neural network that contains three dedicated components. The first component is a fully connected filtering (FCF) layer along the rotation angle direction in the sinogram domain, and the second one is a sinusoidal back-projection (SBP) layer, which back-projects the filtered sinogram data into the spatial domain. Next, a common network structure is added to further improve the overall performance. iRadonMAP is first pretrained on a large number of generic images from the ImageNet database and then fine-tuned with clinical patient data. The experimental results demonstrate the feasibility of the proposed iRadonMAP framework for Radon inversion.","2020-06","2021-06-04 19:05:18","2021-06-07 17:46:29","","2076-2087","","6","39","","","","","","","","","","","","","","","IEEE Xplore","","Conference Name: IEEE Transactions on Medical Imaging","","C:\Users\Asus\Zotero\storage\GYATLHFQ\8950464.html; C:\Users\Asus\Zotero\storage\IUXA973J\He et al. - 2020 - Radon Inversion via Deep Learning.pdf","","","Medical diagnostic imaging; X-ray imaging; Computed tomography; deep learning; Transforms; computed tomography; image reconstruction; Image reconstruction; Radon; Radon inversion; Radon transform","","","","","","","","","","","","","","","","","","","","","","","","","","","","","","","","","","","","","","","","","","","","","",""
"ID5MRU9G","journalArticle","2020","Ho, Yaoshiang; Wookey, Samuel","The Real-World-Weight Cross-Entropy Loss Function: Modeling the Costs of Mislabeling","IEEE Access","","2169-3536","10.1109/ACCESS.2019.2962617","","In this paper, we propose a new metric to measure goodness-of-fit for classifiers: the Real World Cost function. This metric factors in information about a real world problem, such as financial impact, that other measures like accuracy or F1 do not. This metric is also more directly interpretable for users. To optimize for this metric, we introduce the Real-World-Weight Cross-Entropy loss function, in both binary classification and single-label multiclass classification variants. Both variants allow direct input of real world costs as weights. For single-label, multiclass classification, our loss function also allows direct penalization of probabilistic false positives, weighted by label, during the training of a machine learning model. We compare the design of our loss function to the binary cross-entropy and categorical cross-entropy functions, as well as their weighted variants, to discuss the potential for improvement in handling a variety of known shortcomings of machine learning, ranging from imbalanced classes to medical diagnostic error to reinforcement of social bias. We create scenarios that emulate those issues using the MNIST data set and demonstrate empirical results of our new loss function. Finally, we discuss our intuition about why this approach works and sketch a proof based on Maximum Likelihood Estimation.","2020","2021-06-04 19:05:18","2021-06-07 17:46:00","","4806-4813","","","8","","","The Real-World-Weight Cross-Entropy Loss Function","","","","","","","","","","","","IEEE Xplore","","Conference Name: IEEE Access","","C:\Users\Asus\Zotero\storage\PUWBETFZ\Ho and Wookey - 2020 - The Real-World-Weight Cross-Entropy Loss Function.pdf; C:\Users\Asus\Zotero\storage\H5MYZGSU\8943952.html","","","Neural networks; Machine learning; Training; Standards; class imbalance; cross-entropy; ethnic stereotypes; maximum likelihood estimation; Maximum likelihood estimation; Measurement; oversampling; Probabilistic logic; social bias; softmax; undersampling","","","","","","","","","","","","","","","","","","","","","","","","","","","","","","","","","","","","","","","","","","","","","",""
"VZZ6LPUB","journalArticle","2020","Ming, Yao; Xu, Panpan; Cheng, Furui; Qu, Huamin; Ren, Liu","A A ProtoSteer: Steering Deep Sequence Model with Prototypes x","IEEE Transactions on Visualization and Computer Graphics","","1941-0506","10.1109/TVCG.2019.2934267","","Recently we have witnessed growing adoption of deep sequence models (e.g. LSTMs) in many application domains, including predictive health care, natural language processing, and log analysis. However, the intricate working mechanism of these models confines their accessibility to the domain experts. Their black-box nature also makes it a challenging task to incorporate domain-specific knowledge of the experts into the model. In ProtoSteer (Prototype Steering), we tackle the challenge of directly involving the domain experts to steer a deep sequence model without relying on model developers as intermediaries. Our approach originates in case-based reasoning, which imitates the common human problem-solving process of consulting past experiences to solve new problems. We utilize ProSeNet (Prototype Sequence Network), which learns a small set of exemplar cases (i.e., prototypes) from historical data. In ProtoSteer they serve both as an efficient visual summary of the original data and explanations of model decisions. With ProtoSteer the domain experts can inspect, critique, and revise the prototypes interactively. The system then incorporates user-specified prototypes and incrementally updates the model. We conduct extensive case studies and expert interviews in application domains including sentiment analysis on texts and predictive diagnostics based on vehicle fault logs. The results demonstrate that involvements of domain users can help obtain more interpretable models with concise prototypes while retaining similar accuracy.","2020-01","2021-06-04 19:05:18","2021-06-15 11:08:44","","238-248","","1","26","","","ProtoSteer","","","","","","","","","","","","IEEE Xplore","","Conference Name: IEEE Transactions on Visualization and Computer Graphics","","C:\Users\Asus\Zotero\storage\MQW2XUU9\8827944.html","","","Computational modeling; Task analysis; Data models; Machine learning; Predictive models; Prototypes; Data visualization; Explainable Artificial Intelligence (XAI); Prototype Learning; Recurrent Neural Networks (RNNs); Sequence Data","","","","","","","","","","","","","","","","","","","","","","","","","","","","","","","","","","","","","","","","","","","","","",""
"A8TL95WI","journalArticle","2019","Xu, Haotian; Dong, Ming; Lee, Min-Hee; O’Hara, Nolan; Asano, Eishi; Jeong, Jeong-Won","Objective Detection of Eloquent Axonal Pathways to Minimize Postoperative Deficits in Pediatric Epilepsy Surgery Using Diffusion Tractography and Convolutional Neural Networks","IEEE Transactions on Medical Imaging","","1558-254X","10.1109/TMI.2019.2902073","","Convolutional neural networks (CNNs) have recently been used in biomedical imaging applications with great success. In this paper, we investigated the classification performance of CNN models on diffusion weighted imaging (DWI) streamlines defined by functional MRI (fMRI) and electrical stimulation mapping (ESM). To learn a set of discriminative and interpretable features from the extremely unbalanced dataset, we evaluated different CNN architectures with multiple loss functions (e.g., focal loss and center loss) and a soft attention mechanism and compared our models with current state-of-the-art methods. Through extensive experiments on streamlines collected from 70 healthy children and 70 children with focal epilepsy, we demonstrated that our deep CNN model with focal and central losses and soft attention outperforms all existing models in the literature and provides clinically acceptable accuracy (73%-100%) for the objective detection of functionally important white matter pathways, including ESM determined eloquent areas such as primary motors, aphasia, speech arrest, auditory, and visual functions. The findings of this paper encourage further investigations to determine if DWI-CNN analysis can serve as a noninvasive diagnostic tool during pediatric presurgical planning by estimating not only the location of essential cortices at the gyral level but also the underlying fibers connecting these cortical areas to minimize or predict postsurgical functional deficits. This paper translates an advanced CNN model to clinical practice in the pediatric population where currently available approaches (e.g., ESM and fMRI) are suboptimal. The implementation will be released at https://github.com/HaotianMXu/Brain-fiber-classification-using-CNNs.","2019-08","2021-06-04 19:05:18","2021-06-07 17:44:11","","1910-1922","","8","38","","","","","","","","","","","","","","","IEEE Xplore","","Conference Name: IEEE Transactions on Medical Imaging","","C:\Users\Asus\Zotero\storage\WRU5AXL4\8653838.html","","","Visualization; Convolutional neural network; DWI streamline; eloquent function; Epilepsy; epilepsy surgery; Functional magnetic resonance imaging; Pediatrics; Surgery; White matter","","","","","","","","","","","","","","","","","","","","","","","","","","","","","","","","","","","","","","","","","","","","","",""
"FN3HEGGW","journalArticle","","","Text-Guided Neural Network Training for Image Recognition in Natural Scenes and Medicine","","","","","","","","2021-06-16 02:50:22","2021-06-16 02:50:36","","","","","","","","","","","","","","","","","","","","","","","","","","","","","","","","","","","","","","","","","","","","","","","","","","","","","","","","","","","","","","","","","","","","","","","","",""