Title,Abstract
A choices framework for the responsible use of AI,"Popular press and media often make us believe that artificial intelligence technology is ethical or unethical by itself. In this paper, we will argue that organizations that develop or apply AI have certain choices they can make that will lead to a more or less responsible use of AI. By approaching those choices in a methodological way, organizations can make better decisions toward the ethical use of this powerful technology."
A comparative study of evolving fuzzy grammar and machine learning techniques for text categorization,"Several methods have been studied in text categorization and mostly are inspired by the statistical distribution features in the texts, such as the implementation of Machine Learning (ML) methods. However, there is no work available that investigates the performance of ML-based methods against the text expression-based method, especially for incident and medical case categorization. Meanwhile, these two domains are becoming ever more popular, due to a growing interest of automation in security intelligence and health services. This paper presents a text expression-based method called Evolving Fuzzy Grammar (EFG) and evaluates its performance against the conventional ML methods of Naïve Bayes, support vector machine, $$k$$-nearest neighbor, adaptive booting, and decision tree. The incident dataset used is a real dataset that was taken from the World Incidents Tracking System, while ImageCLEF 2009 was used as the source for radiology case reports. The results suggested variations of strength and weakness of each method in both categorization tasks, where a standard evaluation technique (i.e., recall, precision, and $$F$$-measure) was used. In both domains, the SMO and IBk methods were the best, while AdaBoost was the worst. It was also observed that the medical dataset was easier to categorize than the incident. Although EFG was ranked second lowest, it obtained the highest precision score in the bombing categorization, the highest score in armed attack recall, and was averagely ranked in the top three for the medical case categorization. It was also noted that the text expression-based method used in EFG was the most verbose and expressive, when compared to the ML methods. This indicates that EFG is a viable method in text categorization and may serve as an alternative approach to such a task."
A CUDA-powered method for the feature extraction and unsupervised analysis of medical images,"Image texture extraction and analysis are fundamental steps in computer vision. In particular, considering the biomedical field, quantitative imaging methods are increasingly gaining importance because they convey scientifically and clinically relevant information for prediction, prognosis, and treatment response assessment. In this context, radiomic approaches are fostering large-scale studies that can have a significant impact in the clinical practice. In this work, we present a novel method, called CHASM (Cuda, HAralick & SoM), which is accelerated on the graphics processing unit (GPU) for quantitative imaging analyses based on Haralick features and on the self-organizing map (SOM). The Haralick features extraction step relies upon the gray-level co-occurrence matrix, which is computationally burdensome on medical images characterized by a high bit depth. The downstream analyses exploit the SOM with the goal of identifying the underlying clusters of pixels in an unsupervised manner. CHASM is conceived to leverage the parallel computation capabilities of modern GPUs. Analyzing ovarian cancer computed tomography images, CHASM achieved up to $$\sim 19.5\times $$and $$\sim 37\times $$speed-up factors for the Haralick feature extraction and for the SOM execution, respectively, compared to the corresponding C++ coded sequential versions. Such computational results point out the potential of GPUs in the clinical research."
A decomposition of the outlier detection problem into a set of supervised learning problems,"Outlier detection methods automatically identify instances that deviate from the majority of the data. In this paper, we propose a novel approach for unsupervised outlier detection, which re-formulates the outlier detection problem in numerical data as a set of supervised regression learning problems. For each attribute, we learn a predictive model which predicts the values of that attribute from the values of all other attributes, and compute the deviations between the predictions and the actual values. From those deviations, we derive both a weight for each attribute, and a final outlier score using those weights. The weights help separating the relevant attributes from the irrelevant ones, and thus make the approach well suitable for discovering outliers otherwise masked in high-dimensional data. An empirical evaluation shows that our approach outperforms existing algorithms, and is particularly robust in datasets with many irrelevant attributes. Furthermore, we show that if a symbolic machine learning method is used to solve the individual learning problems, the approach is also capable of generating concise explanations for the detected outliers."
A dialogue-based approach for dealing with uncertain and conflicting information in medical diagnosis,"In this paper, we propose a multi-agent framework to deal with situations involving uncertain or inconsistent information located in a distributed environment which cannot be combined into a single knowledge base. To this end, we introduce an inquiry dialogue approach based on a combination of possibilistic logic and a formal argumentation-based theory, where possibilistic logic is used to capture uncertain information, and the argumentation-based approach is used to deal with inconsistent knowledge in a distributed environment. We also modify the framework of earlier work, so that the system is not only easier to implement but also more suitable for educational purposes. The suggested approach is implemented in a clinical decision-support system in the domain of dementia diagnosis. The approach allows the physician to suggest a hypothetical diagnosis in a patient case, which is verified through the dialogue if sufficient patient information is present. If not, the user is informed about the missing information and potential inconsistencies in the information as a way to provide support for continuing medical education. The approach is presented, discussed, and applied to one scenario. The results contribute to the theory and application of inquiry dialogues in situations where the data are uncertain and inconsistent."
A hybrid AI approach for supporting clinical diagnosis of attention deficit hyperactivity disorder (ADHD) in adults,"Attention deficit hyperactivity disorder (ADHD) is a neurodevelopmental disorder that includes symptoms such as inattentiveness, hyperactivity and impulsiveness. It is considered as an important public health issue and prevalence of, as well as demand for diagnosis, has increased as awareness of the disease grew over the past years. Supply of specialist medical experts has not kept pace with the increasing demand for assessment, both due to financial pressures on health systems and the difficulty to train new experts, resulting in growing waiting lists. Patients are not being treated quickly enough causing problems in other areas of health systems (e.g. increased GP visits, increased risk of self-harm and accidents) and more broadly (e.g. time off work, relationship problems). Advances in AI make it possible to support the clinical diagnosis of ADHD based on the analysis of relevant data. This paper reports on findings related to the mental health services of a specialist Trust within the UK’s National Health Service (NHS). The analysis studied data of adult patients who underwent diagnosis over the past few years, and developed a hybrid approach, consisting of two different models: a machine learning model obtained by training on data of past cases; and a knowledge model capturing the expertise of medical experts through knowledge engineering. The resulting algorithm has an accuracy of 95% on data currently available, and is currently being tested in a clinical environment."
A Misdirected Principle with a Catch: Explicability for AI,"There is widespread agreement that there should be a principle requiring that artificial intelligence (AI) be ‘explicable’. Microsoft, Google, the World Economic Forum, the draft AI ethics guidelines for the EU commission, etc. all include a principle for AI that falls under the umbrella of ‘explicability’. Roughly, the principle states that “for AI to promote and not constrain human autonomy, our ‘decision about who should decide’ must be informed by knowledge of how AI would act instead of us” (Floridi et al. in Minds Mach 28(4):689–707, 2018). There is a strong intuition that if an algorithm decides, for example, whether to give someone a loan, then that algorithm should be explicable. I argue here, however, that such a principle is misdirected. The property of requiring explicability should attach to a particular action or decision rather than the entity making that decision. It is the context and the potential harm resulting from decisions that drive the moral need for explicability—not the process by which decisions are reached. Related to this is the fact that AI is used for many low-risk purposes for which it would be unnecessary to require that it be explicable. A principle requiring explicability would prevent us from reaping the benefits of AI used in these situations. Finally, the explanations given by explicable AI are only fruitful if we already know which considerations are acceptable for the decision at hand. If we already have these considerations, then there is no need to use contemporary AI algorithms because standard automation would be available. In other words, a principle of explicability for AI makes the use of AI redundant."
A new approximate query engine based on intelligent capture and fast transformations of granulated data summaries,We outline the processes of intelligent creation and utilization of granulated data summaries in the engine aimed at fast approximate execution of analytical SQL statements. We discuss how to use the introduced engine for the purposes of ad-hoc data exploration over large and quickly increasing data collected in a heterogeneous or distributed fashion. We focus on mechanisms that transform input data summaries into result sets representing query outcomes. We also illustrate how our computational principles can be put together with other paradigms of scaling and harnessing data analytics.
A novel image feature descriptor for SLM spattering pattern classification using a consumable camera,"In selective laser melting (SLM), spattering is an important phenomenon that is highly related to the quality of the manufactured parts. Characterisation and monitoring of spattering behaviours are highly valuable in understanding the manufacturing process and improving the manufacturing quality of SLM. This paper introduces a method of automatic visual classification to distinguish spattering characteristics of SLM processes in different manufacturing conditions. A compact feature descriptor is proposed to represent spattering patterns and its effectiveness is evaluated using real images captured in different conditions. The feature descriptor of this work combines information of spatter trajectory morphology, spatial distributions, and temporal information. The classification is performed using support vector machine (SVM) and random forests for testing and shows highly promising classification accuracy of about 97%. The advantages of this work include compactness for representation and semantic interpretability with the feature description. In addition, the qualities of manufacturing parts are mapped with spattering characteristics under different laser energy densities. Such a map table can be then used to define the desired spatter features, providing a non-contact monitoring solution for online anomaly detection. This work will lead to a further integration of real-time vision monitoring system for an online closed-loop prognostic system for SLM systems, in order to improve the performance in terms of manufacturing quality, power consumption, and fault detection."
A novel image feature descriptor for SLM spattering pattern classification using a consumable camera,"In selective laser melting (SLM), spattering is an important phenomenon that is highly related to the quality of the manufactured parts. Characterisation and monitoring of spattering behaviours are highly valuable in understanding the manufacturing process and improving the manufacturing quality of SLM. This paper introduces a method of automatic visual classification to distinguish spattering characteristics of SLM processes in different manufacturing conditions. A compact feature descriptor is proposed to represent spattering patterns and its effectiveness is evaluated using real images captured in different conditions. The feature descriptor of this work combines information of spatter trajectory morphology, spatial distributions, and temporal information. The classification is performed using support vector machine (SVM) and random forests for testing and shows highly promising classification accuracy of about 97%. The advantages of this work include compactness for representation and semantic interpretability with the feature description. In addition, the qualities of manufacturing parts are mapped with spattering characteristics under different laser energy densities. Such a map table can be then used to define the desired spatter features, providing a non-contact monitoring solution for online anomaly detection. This work will lead to a further integration of real-time vision monitoring system for an online closed-loop prognostic system for SLM systems, in order to improve the performance in terms of manufacturing quality, power consumption, and fault detection."
A novel image feature descriptor for SLM spattering pattern classification using a consumable camera,"In selective laser melting (SLM), spattering is an important phenomenon that is highly related to the quality of the manufactured parts. Characterisation and monitoring of spattering behaviours are highly valuable in understanding the manufacturing process and improving the manufacturing quality of SLM. This paper introduces a method of automatic visual classification to distinguish spattering characteristics of SLM processes in different manufacturing conditions. A compact feature descriptor is proposed to represent spattering patterns and its effectiveness is evaluated using real images captured in different conditions. The feature descriptor of this work combines information of spatter trajectory morphology, spatial distributions, and temporal information. The classification is performed using support vector machine (SVM) and random forests for testing and shows highly promising classification accuracy of about 97%. The advantages of this work include compactness for representation and semantic interpretability with the feature description. In addition, the qualities of manufacturing parts are mapped with spattering characteristics under different laser energy densities. Such a map table can be then used to define the desired spatter features, providing a non-contact monitoring solution for online anomaly detection. This work will lead to a further integration of real-time vision monitoring system for an online closed-loop prognostic system for SLM systems, in order to improve the performance in terms of manufacturing quality, power consumption, and fault detection."
A public unified bug dataset for java and its assessment regarding metrics and bug prediction,"Bug datasets have been created and used by many researchers to build and validate novel bug prediction models. In this work, our aim is to collect existing public source code metric-based bug datasets and unify their contents. Furthermore, we wish to assess the plethora of collected metrics and the capabilities of the unified bug dataset in bug prediction. We considered 5 public datasets and we downloaded the corresponding source code for each system in the datasets and performed source code analysis to obtain a common set of source code metrics. This way, we produced a unified bug dataset at class and file level as well. We investigated the diversion of metric definitions and values of the different bug datasets. Finally, we used a decision tree algorithm to show the capabilities of the dataset in bug prediction. We found that there are statistically significant differences in the values of the original and the newly calculated metrics; furthermore, notations and definitions can severely differ. We compared the bug prediction capabilities of the original and the extended metric suites (within-project learning). Afterwards, we merged all classes (and files) into one large dataset which consists of 47,618 elements (43,744 for files) and we evaluated the bug prediction model build on this large dataset as well. Finally, we also investigated cross-project capabilities of the bug prediction models and datasets. We made the unified dataset publicly available for everyone. By using a public unified dataset as an input for different bug prediction related investigations, researchers can make their studies reproducible, thus able to be validated and verified."
A review of heterogeneous data mining for brain disorder identification,"With rapid advances in neuroimaging techniques, the research on brain disorder identification has become an emerging area in the data mining community. Brain disorder data poses many unique challenges for data mining research. For example, the raw data generated by neuroimaging experiments is in tensor representations, with typical characteristics of high dimensionality, structural complexity, and nonlinear separability. Furthermore, brain connectivity networks can be constructed from the tensor data, embedding subtle interactions between brain regions. Other clinical measures are usually available reflecting the disease status from different perspectives. It is expected that integrating complementary information in the tensor data and the brain network data, and incorporating other clinical parameters will be potentially transformative for investigating disease mechanisms and for informing therapeutic interventions. Many research efforts have been devoted to this area. They have achieved great success in various applications, such as tensor-based modeling, subgraph pattern mining, and multi-view feature analysis. In this paper, we review some recent data mining methods that are used for analyzing brain disorders."
"A Review of Supervised Classification based on Contrast Patterns: Applications, Trends, and Challenges","Supervised classification based on Contrast Patterns (CP) is a trending topic in the pattern recognition literature, partly because it contains an important family of both understandable and accurate classifiers. In this paper, we survey 105 articles and provide an in-depth review of CP-based supervised classification and its applications. Based on our review, we present a taxonomy of the existing application domains of CP-based supervised classification, and a scientometric study. We also discuss potential future research opportunities."
A robust voting approach for diabetes prediction using traditional machine learning techniques,"The noteworthy advances in biotechnology and biomedical sciences have prompted a huge creation of information, for example, high throughput genetic information and clinical data, produced from extensive Electronic Health Records. To this end, utilization of machine learning and data mining techniques in biosciences is by and by crucial and fundamental in endeavors to change cleverly all accessible data into profitable knowledge. Diabetes mellitus is characterized as a gathering of metabolic issue applying critical weight on human health around the world. Broad research in all parts of diabetes (determination, pathophysiology, treatment, and so forth.) has prompted the age of tremendous measures of information. The point of the present examination is to direct an orderly audit of the uses of machine-learning, data mining strategies and instruments in the field of diabetes. The main theme of this work is to provide a system which can prognosticate the diabetes in patients with better accuracy. Here, eleven well-known machine-learning algorithms like Naïve Bayes, K-NN, SVM, Random Forest, Artificial Neural Network, Logistic Regression, Gradient Boosting, Ada Boosting etc. are used for detection of diabetes at an early stage. The evaluations of all the eleven algorithms are examined on various parameters like accuracy, precision, F-measure and recall. After cross-validation and hyper-tuning, the best three machine-learning algorithms are determined and then used in Ensemble Voting Classifier. The experimental results affirm that the pointed framework can accomplish to outstanding outcome of almost 86% accuracy of the Pima Indians Diabetes Database."
A robust voting approach for diabetes prediction using traditional machine learning techniques,"The noteworthy advances in biotechnology and biomedical sciences have prompted a huge creation of information, for example, high throughput genetic information and clinical data, produced from extensive Electronic Health Records. To this end, utilization of machine learning and data mining techniques in biosciences is by and by crucial and fundamental in endeavors to change cleverly all accessible data into profitable knowledge. Diabetes mellitus is characterized as a gathering of metabolic issue applying critical weight on human health around the world. Broad research in all parts of diabetes (determination, pathophysiology, treatment, and so forth.) has prompted the age of tremendous measures of information. The point of the present examination is to direct an orderly audit of the uses of machine-learning, data mining strategies and instruments in the field of diabetes. The main theme of this work is to provide a system which can prognosticate the diabetes in patients with better accuracy. Here, eleven well-known machine-learning algorithms like Naïve Bayes, K-NN, SVM, Random Forest, Artificial Neural Network, Logistic Regression, Gradient Boosting, Ada Boosting etc. are used for detection of diabetes at an early stage. The evaluations of all the eleven algorithms are examined on various parameters like accuracy, precision, F-measure and recall. After cross-validation and hyper-tuning, the best three machine-learning algorithms are determined and then used in Ensemble Voting Classifier. The experimental results affirm that the pointed framework can accomplish to outstanding outcome of almost 86% accuracy of the Pima Indians Diabetes Database."
A semiparametric method for clustering mixed data,"Despite the existence of a large number of clustering algorithms, clustering remains a challenging problem. As large datasets become increasingly common in a number of different domains, it is often the case that clustering algorithms must be applied to heterogeneous sets of variables, creating an acute need for robust and scalable clustering methods for mixed continuous and categorical scale data. We show that current clustering methods for mixed-type data are generally unable to equitably balance the contribution of continuous and categorical variables without strong parametric assumptions. We develop KAMILA (KAy-means for MIxed LArge data), a clustering method that addresses this fundamental problem directly. We study theoretical aspects of our method and demonstrate its effectiveness in a series of Monte Carlo simulation studies and a set of real-world applications."
A set of distinct facial traits learned by machines is not predictive of appearance bias in the wild,"Research in social psychology has shown that people’s biased, subjective judgments about another’s personality based solely on their appearance are not predictive of their actual personality traits. But researchers and companies often utilize computer vision models to predict similarly subjective personality attributes such as “employability”. We seek to determine whether state-of-the-art, black box face processing technology can learn human-like appearance biases. With features extracted with FaceNet, a widely used face recognition framework, we train a transfer learning model on human subjects’ first impressions of personality traits in other faces as measured by social psychologists. We find that features extracted with FaceNet can be used to predict human appearance bias scores for deliberately manipulated faces but not for randomly generated faces scored by humans. Additionally, in contrast to work with human biases in social psychology, the model does not find a significant signal correlating politicians’ vote shares with perceived competence bias. With Local Interpretable Model-Agnostic Explanations (LIME), we provide several explanations for this discrepancy. Our results suggest that some signals of appearance bias documented in social psychology are not embedded by the machine learning techniques we investigate. We shed light on the ways in which appearance bias could be embedded in face processing technology and cast further doubt on the practice of predicting subjective traits based on appearances."
