Title,Abstract
Brain explorer for connectomic analysis,"Visualization plays a vital role in the analysis of multimodal neuroimaging data. A major challenge in neuroimaging visualization is how to integrate structural, functional, and connectivity data to form a comprehensive visual context for data exploration, quality control, and hypothesis discovery. We develop a new integrated visualization solution for brain imaging data by combining scientific and information visualization techniques within the context of the same anatomical structure. In this paper, new surface texture techniques are developed to map non-spatial attributes onto both 3D brain surfaces and a planar volume map which is generated by the proposed volume rendering technique, spherical volume rendering. Two types of non-spatial information are represented: (1) time series data from resting-state functional MRI measuring brain activation; (2) network properties derived from structural connectivity data for different groups of subjects, which may help guide the detection of differentiation features. Through visual exploration, this integrated solution can help identify brain regions with highly correlated functional activations as well as their activation patterns. Visual detection of differentiation features can also potentially discover image-based phenotypic biomarkers for brain diseases."
Bridging the Prototype Gap: On the Evolution of Ugly Ducklings,
CAAI—a cognitive architecture to introduce artificial intelligence in cyber-physical production systems,"This paper introduces CAAI, a novel cognitive architecture for artificial intelligence in cyber-physical production systems. The goal of the architecture is to reduce the implementation effort for the usage of artificial intelligence algorithms. The core of the CAAI is a cognitive module that processes the user’s declarative goals, selects suitable models and algorithms, and creates a configuration for the execution of a processing pipeline on a big data platform. Constant observation and evaluation against performance criteria assess the performance of pipelines for many and different use cases. Based on these evaluations, the pipelines are automatically adapted if necessary. The modular design with well-defined interfaces enables the reusability and extensibility of pipeline components. A big data platform implements this modular design supported by technologies such as Docker, Kubernetes, and Kafka for virtualization and orchestration of the individual components and their communication. The implementation of the architecture is evaluated using a real-world use case. The prototypic implementation is accessible on GitHub and contains a demonstration."
CAAI—a cognitive architecture to introduce artificial intelligence in cyber-physical production systems,"This paper introduces CAAI, a novel cognitive architecture for artificial intelligence in cyber-physical production systems. The goal of the architecture is to reduce the implementation effort for the usage of artificial intelligence algorithms. The core of the CAAI is a cognitive module that processes the user’s declarative goals, selects suitable models and algorithms, and creates a configuration for the execution of a processing pipeline on a big data platform. Constant observation and evaluation against performance criteria assess the performance of pipelines for many and different use cases. Based on these evaluations, the pipelines are automatically adapted if necessary. The modular design with well-defined interfaces enables the reusability and extensibility of pipeline components. A big data platform implements this modular design supported by technologies such as Docker, Kubernetes, and Kafka for virtualization and orchestration of the individual components and their communication. The implementation of the architecture is evaluated using a real-world use case. The prototypic implementation is accessible on GitHub and contains a demonstration."
CAPHAR: context-aware personalized human activity recognition using associative learning in smart environments,"The existing action recognition systems mainly focus on generalized methods to categorize human actions. However, the generalized systems cannot attain the same level of recognition performance for new users mainly due to the high variance in terms of human behavior and the way of performing actions, i.e. activity handling. The use of personalized models based on similarity was introduced to overcome the activity handling problem, but the improvement was found to be limited as the similarity was based on physiognomies rather than the behavior. Moreover, human interaction with contextual information has not been studied extensively in the domain of action recognition. Such interactions can provide an edge for both recognizing high-level activities and improving the personalization effect. In this paper, we propose the context-aware personalized human activity recognition (CAPHAR) framework which computes the class association rules between low-level actions/sensor activations and the contextual information to recognize high-level activities. The personalization in CAPHAR leverages the individual behavior process using a similarity metric to reduce the effect of the activity handling problem. The experimental results on the “daily lifelog” dataset show that CAPHAR can achieve at most 23.73% better accuracy for new users in comparison to the existing classification methods."
Cartesian genetic programming: its status and future,"Cartesian genetic programming, a well-established method of genetic programming, is approximately 20 years old. It represents solutions to computational problems as graphs. Its genetic encoding includes explicitly redundant genes which are well-known to assist in effective evolutionary search. In this article, we review and compare many of the important aspects of the method and findings discussed since its inception. In the process, we make many suggestions for further work which could improve the efficiency of the CGP for solving computational problems."
catch22: CAnonical Time-series CHaracteristics,"Capturing the dynamical properties of time series concisely as interpretable feature vectors can enable efficient clustering and classification for time-series applications across science and industry. Selecting an appropriate feature-based representation of time series for a given application can be achieved through systematic comparison across a comprehensive time-series feature library, such as those in the hctsa toolbox. However, this approach is computationally expensive and involves evaluating many similar features, limiting the widespread adoption of feature-based representations of time series for real-world applications. In this work, we introduce a method to infer small sets of time-series features that (i) exhibit strong classification performance across a given collection of time-series problems, and (ii) are minimally redundant. Applying our method to a set of 93 time-series classification datasets (containing over 147,000 time series) and using a filtered version of the hctsa feature library (4791 features), we introduce a set of 22 CAnonical Time-series CHaracteristics, catch22, tailored to the dynamics typically encountered in time-series data-mining tasks. This dimensionality reduction, from 4791 to 22, is associated with an approximately 1000-fold reduction in computation time and near linear scaling with time-series length, despite an average reduction in classification accuracy of just 7%. catch22 captures a diverse and interpretable signature of time series in terms of their properties, including linear and non-linear autocorrelation, successive differences, value distributions and outliers, and fluctuation scaling properties. We provide an efficient implementation of catch22, accessible from many programming environments, that facilitates feature-based time-series analysis for scientific, industrial, financial and medical applications using a common language of interpretable time-series properties."
catch22: CAnonical Time-series CHaracteristics,"Capturing the dynamical properties of time series concisely as interpretable feature vectors can enable efficient clustering and classification for time-series applications across science and industry. Selecting an appropriate feature-based representation of time series for a given application can be achieved through systematic comparison across a comprehensive time-series feature library, such as those in the hctsa toolbox. However, this approach is computationally expensive and involves evaluating many similar features, limiting the widespread adoption of feature-based representations of time series for real-world applications. In this work, we introduce a method to infer small sets of time-series features that (i) exhibit strong classification performance across a given collection of time-series problems, and (ii) are minimally redundant. Applying our method to a set of 93 time-series classification datasets (containing over 147,000 time series) and using a filtered version of the hctsa feature library (4791 features), we introduce a set of 22 CAnonical Time-series CHaracteristics, catch22, tailored to the dynamics typically encountered in time-series data-mining tasks. This dimensionality reduction, from 4791 to 22, is associated with an approximately 1000-fold reduction in computation time and near linear scaling with time-series length, despite an average reduction in classification accuracy of just 7%. catch22 captures a diverse and interpretable signature of time series in terms of their properties, including linear and non-linear autocorrelation, successive differences, value distributions and outliers, and fluctuation scaling properties. We provide an efficient implementation of catch22, accessible from many programming environments, that facilitates feature-based time-series analysis for scientific, industrial, financial and medical applications using a common language of interpretable time-series properties."
CHIRPS: Explaining random forest classification,"Modern machine learning methods typically produce “black box” models that are opaque to interpretation. Yet, their demand has been increasing in the Human-in-the-Loop processes, that is, those processes that require a human agent to verify, approve or reason about the automated decisions before they can be applied. To facilitate this interpretation, we propose Collection of High Importance Random Path Snippets (CHIRPS); a novel algorithm for explaining random forest classification per data instance. CHIRPS extracts a decision path from each tree in the forest that contributes to the majority classification, and then uses frequent pattern mining to identify the most commonly occurring split conditions. Then a simple, conjunctive form rule is constructed where the antecedent terms are derived from the attributes that had the most influence on the classification. This rule is returned alongside estimates of the rule’s precision and coverage on the training data along with counter-factual details. An experimental study involving nine data sets shows that classification rules returned by CHIRPS have a precision at least as high as the state of the art when evaluated on unseen data (0.91–0.99) and offer a much greater coverage (0.04–0.54). Furthermore, CHIRPS uniquely controls against under- and over-fitting solutions by maximising novel objective functions that are better suited to the local (per instance) explanation setting."
Cloud-based intelligent self-diagnosis and department recommendation service using Chinese medical BERT,"With the rapid development of hospital informatization and Internet medical service in recent years, most hospitals have launched online hospital appointment registration systems to remove patient queues and improve the efficiency of medical services. However, most of the patients lack professional medical knowledge and have no idea of how to choose department when registering. To instruct the patients to seek medical care and register effectively, we proposed CIDRS, an intelligent self-diagnosis and department recommendation framework based on Chinese medical Bidirectional Encoder Representations from Transformers (BERT) in the cloud computing environment. We also established a Chinese BERT model (CHMBERT) trained on a large-scale Chinese medical text corpus. This model was used to optimize self-diagnosis and department recommendation tasks. To solve the limited computing power of terminals, we deployed the proposed framework in a cloud computing environment based on container and micro-service technologies. Real-world medical datasets from hospitals were used in the experiments, and results showed that the proposed model was superior to the traditional deep learning models and other pre-trained language models in terms of performance."
Clusters of male and female Alzheimer’s disease patients in the Alzheimer’s Disease Neuroimaging Initiative (ADNI) database,"This paper presents homogeneous clusters of patients, identified in the Alzheimer’s Disease Neuroimaging Initiative (ADNI) data population of 317 females and 342 males, described by a total of 243 biological and clinical descriptors. Clustering was performed with a novel methodology, which supports identification of patient subpopulations that are homogeneous regarding both clinical and biological descriptors. Properties of the constructed clusters clearly demonstrate the differences between female and male Alzheimer’s disease patient groups. The major difference is the existence of two male subpopulations with unexpected values of intracerebral and whole brain volumes."
cMRI-BED: A novel informatics framework for cardiac MRI biomarker extraction and discovery applied to pediatric cardiomyopathy classification,"Pediatric cardiomyopathies are a rare, yet heterogeneous group of pathologies of the myocardium that are routinely examined clinically using Cardiovascular Magnetic Resonance Imaging (cMRI). This gold standard powerful non-invasive tool yields high resolution temporal images that characterize myocardial tissue. The complexities associated with the annotation of images and extraction of markers, necessitate the development of efficient workflows to acquire, manage and transform this data into actionable knowledge for patient care to reduce mortality and morbidity."
cMRI-BED: A novel informatics framework for cardiac MRI biomarker extraction and discovery applied to pediatric cardiomyopathy classification,"Pediatric cardiomyopathies are a rare, yet heterogeneous group of pathologies of the myocardium that are routinely examined clinically using Cardiovascular Magnetic Resonance Imaging (cMRI). This gold standard powerful non-invasive tool yields high resolution temporal images that characterize myocardial tissue. The complexities associated with the annotation of images and extraction of markers, necessitate the development of efficient workflows to acquire, manage and transform this data into actionable knowledge for patient care to reduce mortality and morbidity."
CNN-based framework using spatial dropping for enhanced interpretation of neural activity in motor imagery classification,"Interpretation of brain activity responses using motor imagery (MI) paradigms is vital for medical diagnosis and monitoring. Assessed by machine learning techniques, identification of imagined actions is hindered by substantial intra- and inter-subject variability. Here, we develop an architecture of Convolutional Neural Networks (CNN) with an enhanced interpretation of the spatial brain neural patterns that mainly contribute to the classification of MI tasks. Two methods of 2D-feature extraction from EEG data are contrasted: Power Spectral Density and Continuous Wavelet Transform. For preserving the spatial interpretation of extracting EEG patterns, we project the multi-channel data using a topographic interpolation. Besides, we include a spatial dropping algorithm to remove the learned weights that reflect the localities not engaged with the elicited brain response. We evaluate two labeled scenarios of MI tasks: bi-class and three-class. Obtained results in an MI database show that the thresholding strategy combined with Continuous Wavelet Transform improves the accuracy and enhances the interpretability of CNN architecture, showing that the highest contribution clusters over the sensorimotor cortex with a differentiated behavior of rhythms $$\mu $$and $$\beta $$."
Cognition and Neurocomputation,
Collaborating AI and human experts in the maintenance domain,"Maintenance decision errors can result in very costly problems. The 4th industrial revolution has given new opportunities for the development of and use of intelligent decision support systems. With these technological advancements, key concerns focus on gaining a better understanding of the linkage between the technicians’ knowledge and the intelligent decision support systems. The research reported in this study has two primary objectives. (1) To propose a theoretical model that links technicians’ knowledge and intelligent decision support systems, and (2) to present a use case how to apply the theoretical model. The foundation of the new model builds upon two main streams of study in the decision support literature: “distribution” of knowledge among different agents, and “collaboration” of knowledge for reaching a shared goal. This study resulted in the identification of two main gaps: firstly, there must be a greater focus upon the technicians’ knowledge; secondly, technicians need assistance to maintain their focus on the big picture. We used the cognitive fit theory, and the theory of distributed situation awareness to propose the new theoretical model called “distributed collaborative awareness model.” The model considers both explicit and implicit knowledge and accommodates the dynamic challenges involved in operational level maintenance. As an application of this model, we identify and recommend some technological developments required in augmented reality based maintenance decision support."
Collaborating AI and human experts in the maintenance domain,"Maintenance decision errors can result in very costly problems. The 4th industrial revolution has given new opportunities for the development of and use of intelligent decision support systems. With these technological advancements, key concerns focus on gaining a better understanding of the linkage between the technicians’ knowledge and the intelligent decision support systems. The research reported in this study has two primary objectives. (1) To propose a theoretical model that links technicians’ knowledge and intelligent decision support systems, and (2) to present a use case how to apply the theoretical model. The foundation of the new model builds upon two main streams of study in the decision support literature: “distribution” of knowledge among different agents, and “collaboration” of knowledge for reaching a shared goal. This study resulted in the identification of two main gaps: firstly, there must be a greater focus upon the technicians’ knowledge; secondly, technicians need assistance to maintain their focus on the big picture. We used the cognitive fit theory, and the theory of distributed situation awareness to propose the new theoretical model called “distributed collaborative awareness model.” The model considers both explicit and implicit knowledge and accommodates the dynamic challenges involved in operational level maintenance. As an application of this model, we identify and recommend some technological developments required in augmented reality based maintenance decision support."
Collaborating AI and human experts in the maintenance domain,"Maintenance decision errors can result in very costly problems. The 4th industrial revolution has given new opportunities for the development of and use of intelligent decision support systems. With these technological advancements, key concerns focus on gaining a better understanding of the linkage between the technicians’ knowledge and the intelligent decision support systems. The research reported in this study has two primary objectives. (1) To propose a theoretical model that links technicians’ knowledge and intelligent decision support systems, and (2) to present a use case how to apply the theoretical model. The foundation of the new model builds upon two main streams of study in the decision support literature: “distribution” of knowledge among different agents, and “collaboration” of knowledge for reaching a shared goal. This study resulted in the identification of two main gaps: firstly, there must be a greater focus upon the technicians’ knowledge; secondly, technicians need assistance to maintain their focus on the big picture. We used the cognitive fit theory, and the theory of distributed situation awareness to propose the new theoretical model called “distributed collaborative awareness model.” The model considers both explicit and implicit knowledge and accommodates the dynamic challenges involved in operational level maintenance. As an application of this model, we identify and recommend some technological developments required in augmented reality based maintenance decision support."
Comparison of feature importance measures as explanations for classification models,"Explainable artificial intelligence is an emerging research direction helping the user or developer of machine learning models understand why models behave the way they do. The most popular explanation technique is feature importance. However, there are several different approaches how feature importances are being measured, most notably global and local. In this study we compare different feature importance measures using both linear (logistic regression with L1 penalization) and non-linear (random forest) methods and local interpretable model-agnostic explanations on top of them. These methods are applied to two datasets from the medical domain, the openly available breast cancer data from the UCI Archive and a recently collected running injury data. Our results show that the most important features differ depending on the technique. We argue that a combination of several explanation techniques could provide more reliable and trustworthy results. In particular, local explanations should be used in the most critical cases such as false negatives."
Comparison of novelty detection methods for multispectral images in rover-based planetary exploration missions,"Science teams for rover-based planetary exploration missions like the Mars Science Laboratory Curiosity rover have limited time for analyzing new data before making decisions about follow-up observations. There is a need for systems that can rapidly and intelligently extract information from planetary instrument datasets and focus attention on the most promising or novel observations. Several novelty detection methods have been explored in prior work for three-channel color images and non-image datasets, but few have considered multispectral or hyperspectral image datasets for the purpose of scientific discovery. We compared the performance of four novelty detection methods—Reed Xiaoli (RX) detectors, principal component analysis (PCA), autoencoders, and generative adversarial networks (GANs)—and the ability of each method to provide explanatory visualizations to help scientists understand and trust predictions made by the system. We show that pixel-wise RX and autoencoders trained with structural similarity (SSIM) loss can detect morphological novelties that are not detected by PCA, GANs, and mean squared error autoencoders, but that the latter methods are better suited for detecting spectral novelties—i.e., the best method for a given setting depends on the type of novelties that are sought. Additionally, we find that autoencoders provide the most useful explanatory visualizations for enabling users to understand and trust model detections, and that existing GAN approaches to novelty detection may be limited in this respect."
Comprehensive structured knowledge base system construction with natural language presentation,"Constructing an ontology-based machine-readable knowledge base system from different sources with minimum human intervention, also known as ontology-based machine-readable knowledge base construction (OMRKBC), has been a long-term outstanding problem. One of the issues is how to build a large-scale OMRKBC process with appropriate structural information. To address this issue, we propose Natural Language Independent Knowledge Representation (NLIKR), a method which regards each word as a concept which should be defined by its relations with other concepts. Using NLIKR, we propose a framework for the OMRKBC process to automatically develop a comprehensive ontology-based machine-readable knowledge base system (OMRKBS) using well-built structural information. Firstly, as part of this framework, we propose formulas to discover concepts and their relations in the OMRKBS. Secondly, the challenges in obtaining rich structured information are resolved through the development of algorithms and rules. Finally, rich structured information is built in the OMRKBS. OMRKBC allows the efficient search of words and supports word queries with a specific attribute. We conduct experiments and analyze the results of relational information extraction, with the results showing that OMRKBS had an accuracy of 84% which was higher than the other knowledge base systems, namely ConceptNet, DBpedia and WordNet."
