Title,Abstract
Multiscale Modeling Meets Machine Learning: What Can We Learn?,"Machine learning is increasingly recognized as a promising technology in the biological, biomedical, and behavioral sciences. There can be no argument that this technique is incredibly successful in image recognition with immediate applications in diagnostics including electrophysiology, radiology, or pathology, where we have access to massive amounts of annotated data. However, machine learning often performs poorly in prognosis, especially when dealing with sparse data. This is a field where classical physics-based simulation seems to remain irreplaceable. In this review, we identify areas in the biomedical sciences where machine learning and multiscale modeling can mutually benefit from one another: Machine learning can integrate physics-based knowledge in the form of governing equations, boundary conditions, or constraints to manage ill-posted problems and robustly handle sparse and noisy data; multiscale modeling can integrate machine learning to create surrogate models, identify system dynamics and parameters, analyze sensitivities, and quantify uncertainty to bridge the scales and understand the emergence of function. With a view towards applications in the life sciences, we discuss the state of the art of combining machine learning and multiscale modeling, identify applications and opportunities, raise open questions, and address potential challenges and limitations. We anticipate that it will stimulate discussion within the community of computational mechanics and reach out to other disciplines including mathematics, statistics, computer science, artificial intelligence, biomedicine, systems biology, and precision medicine to join forces towards creating robust and efficient models for biological systems."
Mutual Explanations for Cooperative Decision Making in Medicine,"Exploiting mutual explanations for interactive learning is presented as part of an interdisciplinary research project on transparent machine learning for medical decision support. Focus of the project is to combine deep learning black box approaches with interpretable machine learning for classification of different types of medical images to combine the predictive accuracy of deep learning and the transparency and comprehensibility of interpretable models. Specifically, we present an extension of the Inductive Logic Programming system Aleph to allow for interactive learning. Medical experts can ask for verbal explanations. They can correct classification decisions and in addition can also correct the explanations. Thereby, expert knowledge can be taken into account in form of constraints for model adaption."
Non-backtracking cycles: length spectrum theory and graph mining applications,"Graph distance and graph embedding are two fundamental tasks in graph mining. For graph distance, determining the structural dissimilarity between networks is an ill-defined problem, as there is no canonical way to compare two networks. Indeed, many of the existing approaches for network comparison differ in their heuristics, efficiency, interpretability, and theoretical soundness. Thus, having a notion of distance that is built on theoretically robust first principles and that is interpretable with respect to features ubiquitous in complex networks would allow for a meaningful comparison between different networks. For graph embedding, many of the popular methods are stochastic and depend on black-box models such as deep networks. Regardless of their high performance, this makes their results difficult to analyze which hinders their usefulness in the development of a coherent theory of complex networks. Here we rely on the theory of the length spectrum function from algebraic topology, and its relationship to the non-backtracking cycles of a graph, in order to introduce two new techniques: Non-Backtracking Spectral Distance (NBD) for measuring the distance between undirected, unweighted graphs, and Non-Backtracking Embedding Dimensions (NBED) for finding a graph embedding in low-dimensional space. Both techniques are interpretable in terms of features of complex networks such as presence of hubs, triangles, and communities. We showcase the ability of NBD to discriminate between networks in both real and synthetic data sets, as well as the potential of NBED to perform anomaly detection. By taking a topological interpretation of non-backtracking cycles, this work presents a novel application of topological data analysis to the study of complex networks."
Optimal classification trees,"State-of-the-art decision tree methods apply heuristics recursively to create each split in isolation, which may not capture well the underlying characteristics of the dataset. The optimal decision tree problem attempts to resolve this by creating the entire decision tree at once to achieve global optimality. In the last 25 years, algorithmic advances in integer optimization coupled with hardware improvements have resulted in an astonishing 800 billion factor speedup in mixed-integer optimization (MIO). Motivated by this speedup, we present optimal classification trees, a novel formulation of the decision tree problem using modern MIO techniques that yields the optimal decision tree for axes-aligned splits. We also show the richness of this MIO formulation by adapting it to give optimal classification trees with hyperplanes that generates optimal decision trees with multivariate splits. Synthetic tests demonstrate that these methods recover the true decision tree more closely than heuristics, refuting the notion that optimal methods overfit the training data. We comprehensively benchmark these methods on a sample of 53 datasets from the UCI machine learning repository. We establish that these MIO methods are practically solvable on real-world datasets with sizes in the 1000s, and give average absolute improvements in out-of-sample accuracy over CART of 1–2 and 3–5% for the univariate and multivariate cases, respectively. Furthermore, we identify that optimal classification trees are likely to outperform CART by 1.2–1.3% in situations where the CART accuracy is high and we have sufficient training data, while the multivariate version outperforms CART by 4–7% when the CART accuracy or dimension of the dataset is low."
Optimal classification trees,"State-of-the-art decision tree methods apply heuristics recursively to create each split in isolation, which may not capture well the underlying characteristics of the dataset. The optimal decision tree problem attempts to resolve this by creating the entire decision tree at once to achieve global optimality. In the last 25 years, algorithmic advances in integer optimization coupled with hardware improvements have resulted in an astonishing 800 billion factor speedup in mixed-integer optimization (MIO). Motivated by this speedup, we present optimal classification trees, a novel formulation of the decision tree problem using modern MIO techniques that yields the optimal decision tree for axes-aligned splits. We also show the richness of this MIO formulation by adapting it to give optimal classification trees with hyperplanes that generates optimal decision trees with multivariate splits. Synthetic tests demonstrate that these methods recover the true decision tree more closely than heuristics, refuting the notion that optimal methods overfit the training data. We comprehensively benchmark these methods on a sample of 53 datasets from the UCI machine learning repository. We establish that these MIO methods are practically solvable on real-world datasets with sizes in the 1000s, and give average absolute improvements in out-of-sample accuracy over CART of 1–2 and 3–5% for the univariate and multivariate cases, respectively. Furthermore, we identify that optimal classification trees are likely to outperform CART by 1.2–1.3% in situations where the CART accuracy is high and we have sufficient training data, while the multivariate version outperforms CART by 4–7% when the CART accuracy or dimension of the dataset is low."
Particularities of data mining in medicine: lessons learned from patient medical time series data analysis,"Nowadays, large amounts of data are generated in the medical domain. Various physiological signals generated from different organs can be recorded to extract interesting information about patients’ health. The analysis of physiological signals is a hard task that requires the use of specific approaches such as the Knowledge Discovery in Databases process. The application of such process in the domain of medicine has a series of implications and difficulties, especially regarding the application of data mining techniques to data, mainly time series, gathered from medical examinations of patients. The goal of this paper is to describe the lessons learned and the experience gathered by the authors applying data mining techniques to real medical patient data including time series. In this research, we carried out an exhaustive case study working on data from two medical fields: stabilometry (15 professional basketball players, 18 elite ice skaters) and electroencephalography (100 healthy patients, 100 epileptic patients). We applied a previously proposed knowledge discovery framework for classification purpose obtaining good results in terms of classification accuracy (greater than 99% in both fields). The good results obtained in our research are the groundwork for the lessons learned and recommendations made in this position paper that intends to be a guide for experts who have to face similar medical data mining projects."
Particularities of data mining in medicine: lessons learned from patient medical time series data analysis,"Nowadays, large amounts of data are generated in the medical domain. Various physiological signals generated from different organs can be recorded to extract interesting information about patients’ health. The analysis of physiological signals is a hard task that requires the use of specific approaches such as the Knowledge Discovery in Databases process. The application of such process in the domain of medicine has a series of implications and difficulties, especially regarding the application of data mining techniques to data, mainly time series, gathered from medical examinations of patients. The goal of this paper is to describe the lessons learned and the experience gathered by the authors applying data mining techniques to real medical patient data including time series. In this research, we carried out an exhaustive case study working on data from two medical fields: stabilometry (15 professional basketball players, 18 elite ice skaters) and electroencephalography (100 healthy patients, 100 epileptic patients). We applied a previously proposed knowledge discovery framework for classification purpose obtaining good results in terms of classification accuracy (greater than 99% in both fields). The good results obtained in our research are the groundwork for the lessons learned and recommendations made in this position paper that intends to be a guide for experts who have to face similar medical data mining projects."
Pattern recognition and pharmacokinetic methods on DCE-MRI data for tumor hypoxia mapping in sarcoma,"The main purpose of this study is to analyze the intrinsic tumor physiologic characteristics in patients with sarcoma through model-free analysis of dynamic contrast enhanced MR imaging data (DCE-MRI). Clinical data were collected from three patients with two different types of histologically proven sarcomas who underwent conventional and advanced MRI examination prior to excision. An advanced matrix factorization algorithm has been applied to the data, resulting in the identification of the principal time-signal uptake curves of DCE-MRI data, which were used to characterize the physiology of the tumor area, described by three different perfusion patterns i.e. hypoxic, well-perfused and necrotic one. The performance of the algorithm was tested by applying different initialization approaches with subsequent comparison of their results. The algorithm was proven to be robust and led to the consistent segmentation of the tumor area in three regions of different perfusion, i.e. well-perfused, hypoxic and necrotic. Results from the model-free approach were compared with a widely used pharmacokinetic (PK) model revealing significant correlations."
PDCOVIDNet: a parallel-dilated convolutional neural network architecture for detecting COVID-19 from chest X-ray images,"The COVID-19 pandemic continues to severely undermine the prosperity of the global health system. To combat this pandemic, effective screening techniques for infected patients are indispensable. There is no doubt that the use of chest X-ray images for radiological assessment is one of the essential screening techniques. Some of the early studies revealed that the patient’s chest X-ray images showed abnormalities, which is natural for patients infected with COVID-19. In this paper, we proposed a parallel-dilated convolutional neural network (CNN) based COVID-19 detection system from chest X-ray images, named as Parallel-Dilated COVIDNet (PDCOVIDNet). First, the publicly available chest X-ray collection fully preloaded and enhanced, and then classified by the proposed method. Differing convolution dilation rate in a parallel form demonstrates the proof-of-principle for using PDCOVIDNet to extract radiological features for COVID-19 detection. Accordingly, we have assisted our method with two visualization methods, which are specifically designed to increase understanding of the key components associated with COVID-19 infection. Both visualization methods compute gradients for a given image category related to feature maps of the last convolutional layer to create a class-discriminative region. In our experiment, we used a total of 2905 chest X-ray images, comprising three cases (such as COVID-19, normal, and viral pneumonia), and empirical evaluations revealed that the proposed method extracted more significant features expeditiously related to suspected disease. The experimental results demonstrate that our proposed method significantly improves performance metrics: the accuracy, precision, recall and F1 scores reach $$96.58\%$$, $$96.58\%$$, $$96.59\%$$and $$96.58\%$$, respectively, which is comparable or enhanced compared with the state-of-the-art methods. We believe that our contribution can support resistance to COVID-19, and will adopt for COVID-19 screening in AI-based systems."
Personalized support for well-being at work: an overview of the SWELL project,"Recent advances in wearable sensor technology and smartphones enable simple and affordable collection of personal analytics. This paper reflects on the lessons learned in the SWELL project that addressed the design of user-centered ICT applications for self-management of vitality in the domain of knowledge workers. These workers often have a sedentary lifestyle and are susceptible to mental health effects due to a high workload. We present the sense–reason–act framework that is the basis of the SWELL approach and we provide an overview of the individual studies carried out in SWELL. In this paper, we revisit our work on reasoning: interpreting raw heterogeneous sensor data, and acting: providing personalized feedback to support behavioural change. We conclude that simple affordable sensors can be used to classify user behaviour and heath status in a physically non-intrusive way. The interpreted data can be used to inform personalized feedback strategies. Further longitudinal studies can now be initiated to assess the effectiveness of m-Health interventions using the SWELL methods."
Personalized support for well-being at work: an overview of the SWELL project,"Recent advances in wearable sensor technology and smartphones enable simple and affordable collection of personal analytics. This paper reflects on the lessons learned in the SWELL project that addressed the design of user-centered ICT applications for self-management of vitality in the domain of knowledge workers. These workers often have a sedentary lifestyle and are susceptible to mental health effects due to a high workload. We present the sense–reason–act framework that is the basis of the SWELL approach and we provide an overview of the individual studies carried out in SWELL. In this paper, we revisit our work on reasoning: interpreting raw heterogeneous sensor data, and acting: providing personalized feedback to support behavioural change. We conclude that simple affordable sensors can be used to classify user behaviour and heath status in a physically non-intrusive way. The interpreted data can be used to inform personalized feedback strategies. Further longitudinal studies can now be initiated to assess the effectiveness of m-Health interventions using the SWELL methods."
Phase II monitoring of simple linear profiles with random explanatory variables,"In many practical situations, quality of a process or product can well be characterized by a relation between a response variable and one or more explanatory variables. This functional relationship which is commonly referred to as profile has been addressed by many researchers for the case of fixed explanatory variable. However, there are some situations where this assumption may not hold. In this paper, we try to investigate the effect of random explanatory variable on phase II monitoring of simple linear profiles. Average run length criterion is used to evaluate both the in-control and out-of-control performances of the control schemes commonly considered for phase II profile monitoring. The charting performance of the EWMA-3 control scheme has been improved using a novel technique."
Precision education with statistical learning and deep learning: a case study in Taiwan,"The low birth rate in Taiwan has led to a severe challenge for many universities to enroll a sufficient number of students. Consequently, a large number of students have been admitted to universities regardless of whether they have an aptitude for academic studies. Early diagnosis of students with a high dropout risk enables interventions to be provided early on, which can help these students to complete their studies, graduate, and enhance their future competitiveness in the workplace. Effective prelearning interventions are necessary, therefore students’ learning backgrounds should be thoroughly examined. This study investigated how big data and artificial intelligence can be used to help universities to more precisely understand student backgrounds, according to which corresponding interventions can be provided. For this study, 3552 students from a university in Taiwan were sampled. A statistical learning method and a machine learning method based on deep neural networks were used to predict their probability of dropping out. The results revealed that student academic performance (regarding the dynamics of class ranking percentage), student loan applications, the number of absences from school, and the number of alerted subjects successfully predicted whether or not students would drop out of university with an accuracy rate of 68% when the statistical learning method was employed, and 77% for the deep learning method, in the case of giving first priority to the high sensitivity in predicting dropouts. However, when the specificity metric was preferred, then the two approaches both reached more than 80% accuracy rates. These results may enable the university to provide interventions to students for assisting course selection and enhancing their competencies based on their aptitudes, potentially reducing the dropout rate and facilitating adaptive learning, thereby achieving a win-win situation for both the university and the students. This research offers a feasible direction for using artificial intelligence applications on the basis of a university’s institutional research database."
Precision education with statistical learning and deep learning: a case study in Taiwan,"The low birth rate in Taiwan has led to a severe challenge for many universities to enroll a sufficient number of students. Consequently, a large number of students have been admitted to universities regardless of whether they have an aptitude for academic studies. Early diagnosis of students with a high dropout risk enables interventions to be provided early on, which can help these students to complete their studies, graduate, and enhance their future competitiveness in the workplace. Effective prelearning interventions are necessary, therefore students’ learning backgrounds should be thoroughly examined. This study investigated how big data and artificial intelligence can be used to help universities to more precisely understand student backgrounds, according to which corresponding interventions can be provided. For this study, 3552 students from a university in Taiwan were sampled. A statistical learning method and a machine learning method based on deep neural networks were used to predict their probability of dropping out. The results revealed that student academic performance (regarding the dynamics of class ranking percentage), student loan applications, the number of absences from school, and the number of alerted subjects successfully predicted whether or not students would drop out of university with an accuracy rate of 68% when the statistical learning method was employed, and 77% for the deep learning method, in the case of giving first priority to the high sensitivity in predicting dropouts. However, when the specificity metric was preferred, then the two approaches both reached more than 80% accuracy rates. These results may enable the university to provide interventions to students for assisting course selection and enhancing their competencies based on their aptitudes, potentially reducing the dropout rate and facilitating adaptive learning, thereby achieving a win-win situation for both the university and the students. This research offers a feasible direction for using artificial intelligence applications on the basis of a university’s institutional research database."
Predicting and explaining behavioral data with structured feature space decomposition,"Modeling human behavioral data is challenging due to its scale, sparseness (few observations per individual), heterogeneity (differently behaving individuals), and class imbalance (few observations of the outcome of interest). An additional challenge is learning an interpretable model that not only accurately predicts outcomes, but also identifies important factors associated with a given behavior. To address these challenges, we describe a statistical approach to modeling behavioral data called the structured sum-of-squares decomposition (S3D). The algorithm, which is inspired by decision trees, selects important features that collectively explain the variation of the outcome, quantifies correlations between the features, and bins the subspace of important features into smaller, more homogeneous blocks that correspond to similarly-behaving subgroups within the population. This partitioned subspace allows us to predict and analyze the behavior of the outcome variable both statistically and visually, giving a medium to examine the effect of various features and to create explainable predictions. We apply S3D to learn models of online activity from large-scale data collected from diverse sites, such as Stack Exchange, Khan Academy, Twitter, Duolingo, and Digg. We show that S3D creates parsimonious models that can predict outcomes in the held-out data at levels comparable to state-of-the-art approaches, but in addition, produces interpretable models that provide insights into behaviors. This is important for informing strategies aimed at changing behavior, designing social systems, but also for explaining predictions, a critical step towards minimizing algorithmic bias."
Predicting contact-without-connection defects on printed circuit boards employing ball grid array package types: a data analytics case study in the smart manufacturing environment,"This research presents an exploratory data analytics case study in defect prediction on printed circuit boards (PCB) employing ball grid array (BGA) package types during assembly. BGA package types are of interest because defects are difficult to identify and costly to rework. While much of the existing research is dedicated to techniques to identify and diagnose BGA defects, this research attempts to preempt them by using parametric data measured by solder paste inspection (SPI) machines as input data to applied machine learning models. Two modeling approaches are explored: one approach to analyze individual solder paste deposits and the other approach to holistically analyze all solder paste deposits on a single PCB location. The latter approach employs feature generation to extract a broad set of features from the arrays of SPI data and feature selection techniques for dimensionality reduction. Models trained on the reduced feature sets provide encouraging initial results, with precision, recall, and f1 score metrics exceeding 0.82, 0.50, and 0.62 respectively for each of two datasets analyzed."
