Title,Abstract
From Fifth Generation Computing to Skill Science,"Professor Koichi Furukawa, an eminent computer scientist and former Editor-in-Chief of the New Generation Computing journal, passed away on January 31, 2017. His passing was a surprise, and we were all shocked and saddened by the news. To remember the deceased, this article reviews the great career and contributions of Professor Koichi Furukawa, focusing on his research activities on the foundation and application of logic programming. Professor Furukawa had both a deep understanding and broad impact on logic programming, and he was always gentle but persistent in articulating its value across a broad spectrum of computer science and artificial intelligence research. This article introduces his research along with its insightful and unique philosophical framework."
From free text to clusters of content in health records: an unsupervised graph partitioning approach,"Electronic healthcare records contain large volumes of unstructured data in different forms. Free text constitutes a large portion of such data, yet this source of richly detailed information often remains under-used in practice because of a lack of suitable methodologies to extract interpretable content in a timely manner. Here we apply network-theoretical tools to the analysis of free text in Hospital Patient Incident reports in the English National Health Service, to find clusters of reports in an unsupervised manner and at different levels of resolution based directly on the free text descriptions contained within them. To do so, we combine recently developed deep neural network text-embedding methodologies based on paragraph vectors with multi-scale Markov Stability community detection applied to a similarity graph of documents obtained from sparsified text vector similarities. We showcase the approach with the analysis of incident reports submitted in Imperial College Healthcare NHS Trust, London. The multiscale community structure reveals levels of meaning with different resolution in the topics of the dataset, as shown by relevant descriptive terms extracted from the groups of records, as well as by comparing a posteriori against hand-coded categories assigned by healthcare personnel. Our content communities exhibit good correspondence with well-defined hand-coded categories, yet our results also provide further medical detail in certain areas as well as revealing complementary descriptors of incidents beyond the external classification. We also discuss how the method can be used to monitor reports over time and across different healthcare providers, and to detect emerging trends that fall outside of pre-existing categories."
Generalized word shift graphs: a method for visualizing and explaining pairwise comparisons between texts,"A common task in computational text analyses is to quantify how two corpora differ according to a measurement like word frequency, sentiment, or information content. However, collapsing the texts’ rich stories into a single number is often conceptually perilous, and it is difficult to confidently interpret interesting or unexpected textual patterns without looming concerns about data artifacts or measurement validity. To better capture fine-grained differences between texts, we introduce generalized word shift graphs, visualizations which yield a meaningful and interpretable summary of how individual words contribute to the variation between two texts for any measure that can be formulated as a weighted average. We show that this framework naturally encompasses many of the most commonly used approaches for comparing texts, including relative frequencies, dictionary scores, and entropy-based measures like the Kullback–Leibler and Jensen–Shannon divergences. Through a diverse set of case studies ranging from presidential speeches to tweets posted in urban green spaces, we demonstrate how generalized word shift graphs can be flexibly applied across domains for diagnostic investigation, hypothesis generation, and substantive interpretation. By providing a detailed lens into textual shifts between corpora, generalized word shift graphs help computational social scientists, digital humanists, and other text analysis practitioners fashion more robust scientific narratives."
Gradient-based boosting for statistical relational learning: the Markov logic network and missing data cases,"Recent years have seen a surge of interest in Statistical Relational Learning (SRL) models that combine logic with probabilities. One prominent and highly expressive SRL model is Markov Logic Networks (MLNs), but the expressivity comes at the cost of learning complexity. Most of the current methods for learning MLN structure follow a two-step approach where first they search through the space of possible clauses (i.e. structures) and then learn weights via gradient descent for these clauses. We present a functional-gradient boosting algorithm to learn both the weights (in closed form) and the structure of the MLN simultaneously. Moreover most of the learning approaches for SRL apply the closed-world assumption, i.e., whatever is not observed is assumed to be false in the world. We attempt to open this assumption. We extend our algorithm for MLN structure learning to handle missing data by using an EM-based approach and show this algorithm can also be used to learn Relational Dependency Networks and relational policies. Our results in many domains demonstrate that our approach can effectively learn MLNs even in the presence of missing data."
Graph clustering-based discretization of splitting and merging methods (GraphS and GraphM),"Discretization plays a major role as a data preprocessing technique used in machine learning and data mining. Recent studies have focused on multivariate discretization that considers relations among attributes. The general goal of this method is to obtain the discrete data, which preserves most of the semantics exhibited by original continuous data. However, many techniques generate the final discrete data that may be less useful with natural groups of data not being maintained. This paper presents a novel graph clustering-based discretization algorithm that encodes different similarity measures into a graph representation of the examined data. The intuition allows more refined data-wise relations to be obtained and used with the effective graph clustering technique based on normalized association to discover nature graphs accurately. The goodness of this approach is empirically demonstrated over 30 standard datasets and 20 imbalanced datasets, compared with 11 well-known discretization algorithms using 4 classifiers. The results suggest the new approach is able to preserve the natural groups and usually achieve the efficiency in terms of classifier performance, and the desired number of intervals than the comparative methods."
Hemodynamic numerical simulations of the disturbance due to intracoronary flow measurements by a Doppler guide wire,"Since hemodynamics plays a key role in the development and evolution of cardiovascular pathologies, physician’s decision must be based on proper monitoring of relevant physiological flow quantities."
Homogeneous clusters of Alzheimer’s disease patient population,Identification of biomarkers for the Alzheimer’s disease (AD) is a challenge and a very difficult task both for medical research and data analysis.
How artificial intelligence and machine learning can help healthcare systems respond to COVID-19,"The COVID-19 global pandemic is a threat not only to the health of millions of individuals, but also to the stability of infrastructure and economies around the world.The disease will inevitably place an overwhelming burden on healthcare systems that cannot be effectively dealt with by existing facilities or responses based on conventional approaches. We believe that a rigorous clinical and societal response can only be mounted by using intelligence derived from a variety of data sources to better utilize scarce healthcare resources, provide personalized patient management plans, inform policy, and expedite clinical trials.In this paper, we introduce five of the most important challenges in responding to COVID-19 and show how each of them can be addressed by recent developments in machine learning (ML) and artificial intelligence (AI).We argue that the integration of these techniques into local, national, and international healthcare systems will save lives, and propose specific methods by which implementation can happen swiftly and efficiently. We offer to extend these resources and knowledge to assist policymakers seeking to implement these techniques."
How artificial intelligence and machine learning can help healthcare systems respond to COVID-19,"The COVID-19 global pandemic is a threat not only to the health of millions of individuals, but also to the stability of infrastructure and economies around the world.The disease will inevitably place an overwhelming burden on healthcare systems that cannot be effectively dealt with by existing facilities or responses based on conventional approaches. We believe that a rigorous clinical and societal response can only be mounted by using intelligence derived from a variety of data sources to better utilize scarce healthcare resources, provide personalized patient management plans, inform policy, and expedite clinical trials.In this paper, we introduce five of the most important challenges in responding to COVID-19 and show how each of them can be addressed by recent developments in machine learning (ML) and artificial intelligence (AI).We argue that the integration of these techniques into local, national, and international healthcare systems will save lives, and propose specific methods by which implementation can happen swiftly and efficiently. We offer to extend these resources and knowledge to assist policymakers seeking to implement these techniques."
"How can humans understand their automated cars? HMI principles, problems and solutions","As long as vehicles do not provide full automation, the design and function of the Human Machine Interface (HMI) is crucial for ensuring that the human “driver” and the vehicle-based automated systems collaborate in a safe manner. When the driver is decoupled from active control, the design of the HMI becomes even more critical. Without mutual understanding, the two agents (human and vehicle) will fail to accurately comprehend each other’s intentions and actions. This paper proposes a set of design principles for in-vehicle HMI and reviews some current HMI designs in the light of those principles. We argue that in many respects, the current designs fall short of best practice and have the potential to confuse the driver. This can lead to a mismatch between the operation of the automation in the light of the current external situation and the driver’s awareness of how well the automation is currently handling that situation. A model to illustrate how the various principles are interrelated is proposed. Finally, recommendations are made on how, building on each principle, HMI design solutions can be adopted to address these challenges."
Hybrid collective intelligence in a human–AI society,"Within current debates about the future impact of Artificial Intelligence (AI) on human society, roughly three different perspectives can be recognised: (1) the technology-centric perspective, claiming that AI will soon outperform humankind in all areas, and that the primary threat for humankind is superintelligence; (2) the human-centric perspective, claiming that humans will always remain superior to AI when it comes to social and societal aspects, and that the main threat of AI is that humankind’s social nature is overlooked in technological designs; and (3) the collective intelligence-centric perspective, claiming that true intelligence lies in the collective of intelligent agents, both human and artificial, and that the main threat for humankind is that technological designs create problems at the collective, systemic level that are hard to oversee and control. The current paper offers the following contributions: (a) a clear description for each of the three perspectives, along with their history and background; (b) an analysis and interpretation of current applications of AI in human society according to each of the three perspectives, thereby disentangling miscommunication in the debate concerning threats of AI; and (c) a new integrated and comprehensive research design framework that addresses all aspects of the above three perspectives, and includes principles that support developers to reflect and anticipate upon potential effects of AI in society."
Hybrid-augmented intelligence: collaboration and cognition,"The long-term goal of artificial intelligence (AI) is to make machines learn and think like human beings. Due to the high levels of uncertainty and vulnerability in human life and the open-ended nature of problems that humans are facing, no matter how intelligent machines are, they are unable to completely replace humans. Therefore, it is necessary to introduce human cognitive capabilities or human-like cognitive models into AI systems to develop a new form of AI, that is, hybrid-augmented intelligence. This form of AI or machine intelligence is a feasible and important developing model. Hybrid-augmented intelligence can be divided into two basic models: one is human-in-the-loop augmented intelligence with human-computer collaboration, and the other is cognitive computing based augmented intelligence, in which a cognitive model is embedded in the machine learning system. This survey describes a basic framework for human-computer collaborative hybrid-augmented intelligence, and the basic elements of hybrid-augmented intelligence based on cognitive computing. These elements include intuitive reasoning, causal models, evolution of memory and knowledge, especially the role and basic principles of intuitive reasoning for complex problem solving, and the cognitive learning framework for visual scene understanding based on memory and reasoning. Several typical applications of hybrid-augmented intelligence in related fields are given."
Hybrid-augmented intelligence: collaboration and cognition,"The long-term goal of artificial intelligence (AI) is to make machines learn and think like human beings. Due to the high levels of uncertainty and vulnerability in human life and the open-ended nature of problems that humans are facing, no matter how intelligent machines are, they are unable to completely replace humans. Therefore, it is necessary to introduce human cognitive capabilities or human-like cognitive models into AI systems to develop a new form of AI, that is, hybrid-augmented intelligence. This form of AI or machine intelligence is a feasible and important developing model. Hybrid-augmented intelligence can be divided into two basic models: one is human-in-the-loop augmented intelligence with human-computer collaboration, and the other is cognitive computing based augmented intelligence, in which a cognitive model is embedded in the machine learning system. This survey describes a basic framework for human-computer collaborative hybrid-augmented intelligence, and the basic elements of hybrid-augmented intelligence based on cognitive computing. These elements include intuitive reasoning, causal models, evolution of memory and knowledge, especially the role and basic principles of intuitive reasoning for complex problem solving, and the cognitive learning framework for visual scene understanding based on memory and reasoning. Several typical applications of hybrid-augmented intelligence in related fields are given."
Image Fusion Techniques: A Survey,"The necessity of image fusion is growing in recently in image processing applications due to the tremendous amount of acquisition systems. Fusion of images is defined as an alignment of noteworthy Information from diverse sensors using various mathematical models to generate a single compound image. The fusion of images is used for integrating the complementary multi-temporal, multi-view and multi-sensor Information into a single image with improved image quality and by keeping the integrity of important features. It is considered as a vital pre-processing phase for several applications such as robot vision, aerial, satellite imaging, medical imaging, and a robot or vehicle guidance. In this paper, various state-of-art image fusion methods of diverse levels with their pros and cons, various spatial and transform based method with quality metrics and their applications in different domains have been discussed. Finally, this review has concluded various future directions for different applications of image fusion."
Improving predictions of pediatric surgical durations with supervised learning,"Effective management of operating room resources relies on accurate predictions of surgical case durations. This prediction problem is known to be particularly difficult in pediatric hospitals due to the extreme variation in pediatric patient populations. We pursue two supervised learning approaches: (1) We directly predict the surgical case durations using features derived from electronic medical records and from hospital operational information. For this regression problem, we propose a novel metric for measuring accuracy of predictions which captures key issues relevant to hospital operations. We evaluate several prediction models; some are automated (they do not require input from surgeons) while others are semi-automated (they do require input from surgeons). We see that many of our automated methods generally outperform currently used algorithms and our semi-automated methods can outperform surgeons by a substantial margin. (2) We consider a classification problem in which each prediction provided by a surgeon is predicted to be correct, an overestimate, or an underestimate. This classification mechanism builds on the metric mentioned above and could potentially be useful for detecting human errors. Both supervised learning approaches give insights into the feature engineering process while creating the basis for decision support tools."
Inference and reasoning in a Bayesian knowledge-intensive CBR system,"This paper presents the inference and reasoning methods in a Bayesian supported knowledge-intensive case-based reasoning (CBR) system called BNCreek. The inference and reasoning process in this system is a combination of three methods. The semantic network inference methods and the CBR method are employed to handle the difficulties of inferencing and reasoning in uncertain domains. The Bayesian network inference methods are employed to make the process more accurate. An experiment from oil well drilling as a complex and uncertain application domain is conducted. The system is evaluated against expert estimations and compared with seven other corresponding systems. The normalized discounted cumulative gain (NDCG) as a rank-based metric, the weighted error (WE), and root-square error (RSE) as the statistical metrics are employed to evaluate different aspects of the system capabilities. The results show the efficiency of the developed inference and reasoning methods."
Instance spaces for machine learning classification,"This paper tackles the issue of objective performance evaluation of machine learning classifiers, and the impact of the choice of test instances. Given that statistical properties or features of a dataset affect the difficulty of an instance for particular classification algorithms, we examine the diversity and quality of the UCI repository of test instances used by most machine learning researchers. We show how an instance space can be visualized, with each classification dataset represented as a point in the space. The instance space is constructed to reveal pockets of hard and easy instances, and enables the strengths and weaknesses of individual classifiers to be identified. Finally, we propose a methodology to generate new test instances with the aim of enriching the diversity of the instance space, enabling potentially greater insights than can be afforded by the current UCI repository."
Intelligent medical image grouping through interactive learning,"Image grouping in knowledge-rich domains is challenging, since domain knowledge and human expertise are key to transform image pixels into meaningful content. Manually marking and annotating images is not only labor-intensive but also ineffective. Furthermore, most traditional machine learning approaches cannot bridge this gap for the absence of experts’ input. We thus present an interactive machine learning paradigm that allows experts to become an integral part of the learning process. This paradigm is designed for automatically computing and quantifying interpretable grouping of dermatological images. In this way, the computational evolution of an image grouping model, its visualization, and expert interactions form a loop to improve image grouping. In our paradigm, dermatologists encode their domain knowledge about the medical images by grouping a small subset of images vicarefully designed interface. Our learning algorithm automatically incorporates these manually specified connections as constraints for reorganizing the whole image dataset. Performance evaluation shows that this paradigm effectively improves image grouping based on expert knowledge."
Interactive machine learning: experimental evidence for the human in the algorithmic loop,"Recent advances in automatic machine learning (aML) allow solving problems without any human intervention. However, sometimes a human-in-the-loop can be beneficial in solving computationally hard problems. In this paper we provide new experimental insights on how we can improve computational intelligence by complementing it with human intelligence in an interactive machine learning approach (iML). For this purpose, we used the Ant Colony Optimization (ACO) framework, because this fosters multi-agent approaches with human agents in the loop. We propose unification between the human intelligence and interaction skills and the computational power of an artificial system. The ACO framework is used on a case study solving the Traveling Salesman Problem, because of its many practical implications, e.g. in the medical domain. We used ACO due to the fact that it is one of the best algorithms used in many applied intelligence problems. For the evaluation we used gamification, i.e. we implemented a snake-like game called Traveling Snakesman with the MAX–MIN Ant System (MMAS) in the background. We extended the MMAS–Algorithm in a way, that the human can directly interact and influence the ants. This is done by “traveling” with the snake across the graph. Each time the human travels over an ant, the current pheromone value of the edge is multiplied by 5. This manipulation has an impact on the ant’s behavior (the probability that this edge is taken by the ant increases). The results show that the humans performing one tour through the graphs have a significant impact on the shortest path found by the MMAS. Consequently, our experiment demonstrates that in our case human intelligence can positively influence machine intelligence. To the best of our knowledge this is the first study of this kind."
Interpreting SVM for medical images using Quadtree,"In this paper, we propose a quadtree based approach to capture the spatial information of medical images for explaining nonlinear SVM prediction. In medical image classification, interpretability becomes important to understand why the adopted model works. Explaining an SVM prediction is difficult due to implicit mapping done in kernel classification is uninformative about the position of data points in the feature space and the nature of the separating hyperplane in the original space. The proposed method finds ROIs which contain the discriminative regions behind the prediction. Localization of the discriminative region in small boxes can help in interpreting the prediction by SVM. Quadtree decomposition is applied recursively before applying SVMs on sub images and model identified ROIs are highlighted. Pictorial results of experiments on various medical image datasets prove the effectiveness of this approach. We validate the correctness of our method by applying occlusion methods."
Knowledge structure transition in library and information science: topic modeling and visualization,"The purpose of this research is to identify topics in library and information science (LIS) using latent Dirichlet allocation (LDA) and to visualize the knowledge structure of the field as consisting of specific topics and its transition from 2000–2002 to 2015–2017. The full text of 1648 research articles from five peer-reviewed representative LIS journals in these two periods was analyzed by using LDA. A total of 30 topics in each period were labeled based on the frequency of terms and the contents of the articles. These topics were plotted on a two-dimensional map using LDAvis and categorized based on their location and characteristics in the plots. Although research areas in some forms were persistent with which discovered in previous studies, they were crucial to the transition of the knowledge structure in LIS and had the following three features: (1) The Internet became the premise of research in LIS in 2015–2017. (2) Theoretical approach or empirical work can be considered as a factor in the transition of the knowledge structure in some categories. (3) The topic diversity of the five core LIS journals decreased from the 2000–2002 to 2015–2017."
